move_effect_id,local_language_id,short_effect,effect
145,9,Inflicts twice the damage the user received from the last special hit it took.,"Targets the last opposing Pokémon to hit the user with a [special]{mechanic:special} move this turn.  Inflicts twice the damage that move did to the user.  If there is no eligible target, this move will [fail]{mechanic:fail}.  Type immunity applies, but other type effects are ignored.

This move cannot be copied by [Mirror Move]{move:mirror-move}, nor selected by [Assist]{move:assist} or [Metronome]{move:metronome}."
146,9,Raises the user's Defense by one stage.  User charges for one turn before attacking.,"Inflicts [regular damage]{mechanic:regular damage}.  Raises the user's [Defense]{mechanic:defense} by one [stage]{mechanic:stage}.  User then charges for one turn before attacking.

This move cannot be selected by [Sleep Talk]{move:sleep-talk}."
147,9,Has a $effect_chance% chance to make the target flinch.,"Inflicts [regular damage]{mechanic:regular damage}.  Has a $effect_chance% chance to make each target [flinch]{mechanic:flinch}.

If the target is under the effect of [Bounce]{move:bounce}, [Fly]{move:fly}, or [Sky Drop]{move:sky-drop}, this move will hit with double power."
148,9,Inflicts regular damage and can hit Dig users.,"Inflicts [regular damage]{mechanic:regular damage}.

If the target is in the first turn of [Dig]{move:dig}, this move will hit with double power."
149,9,Hits the target two turns later.,"Inflicts [typeless]{mechanic:typeless} [regular damage]{mechanic:regular damage} at the end of the third turn, starting with this one.  This move cannot score a [critical hit]{mechanic:critical hit}.  If the target [switches out]{mechanic:switches out}, its replacement will be hit instead.  Damage is calculated at the time this move is used; [stat changes]{mechanic:stat changes} and [switching out]{mechanic:switching out} during the delay won't change the damage inflicted.  No move with this effect can be used against the same target again until after the end of the third turn.

This effect breaks through [Wonder Guard]{ability:wonder-guard}.

If the target is protected by [Protect]{move:protect} or [Detect]{move:detect} on the turn this move is used, this move will fail.  However, the damage on the third turn will break through protection.

The damage is applied at the end of the turn, so it ignores [Endure]{move:endure} and [Focus Sash]{item:focus-sash}.

This move cannot be copied by [Mirror Move]{move:mirror-move}."
150,9,Inflicts regular damage and can hit Pokémon in the air.,"Inflicts [regular damage]{mechanic:regular damage}.

If the target is under the effect of [Bounce]{move:bounce}, [Fly]{move:fly}, or [Sky Drop]{move:sky-drop}, this move will hit with double power."
151,9,Has a $effect_chance% chance to make the target flinch.,"Inflicts [regular damage]{mechanic:regular damage}.  Has a $effect_chance% chance to make the target [flinch]{mechanic:flinch}.

Power is doubled against Pokémon that have used [Minimize]{move:minimize} since entering the [field]{mechanic:field}."
152,9,Requires a turn to charge before attacking.,"Inflicts [regular damage]{mechanic:regular damage}.  User charges for one turn before attacking.

During [Sunny Day]{move:sunny-day}, the charge turn is skipped.

During [Hail]{move:hail}, [Rain Dance]{move:rain-dance}, or [Sandstorm]{move:sandstorm}, power is halved.

This move cannot be selected by [Sleep Talk]{move:sleep-talk}."
153,9,Has a $effect_chance% chance to paralyze the target.,"Inflicts [regular damage]{mechanic:regular damage}.  Has a $effect_chance% chance to [paralyze]{mechanic:paralyze} the target.

During [Rain Dance]{move:rain-dance}, this move has 100% accuracy.  It also has a (100 - accuracy)% chance to break through the protection of [Protect]{move:protect} and [Detect]{move:detect}.

During [Sunny Day]{move:sunny-day}, this move has 50% accuracy."
154,9,Immediately ends wild battles.  No effect otherwise.,Does nothing.  Wild battles end immediately.
155,9,Hits once for every conscious Pokémon the trainer has.,"Inflicts [typeless]{mechanic:typeless} [regular damage]{mechanic:regular damage}.  Every Pokémon in the user's party, excepting those that have fainted or have a [major status effect]{mechanic:major status effect}, attacks the target.  Calculated stats are ignored; the base stats for the target and assorted attackers are used instead.  The random factor in the damage formula is not used.  [Dark]{type:dark} Pokémon still get [STAB]{mechanic:stab}.

This effect breaks through [Wonder Guard]{ability:wonder-guard}."
156,9,"User flies high into the air, dodging all attacks, and hits next turn.","Inflicts [regular damage]{mechanic:regular damage}.  User flies high into the air for one turn, becoming immune to attack, and hits on the second turn.

During the immune turn, [Gust]{move:gust}, [Hurricane]{move:hurricane}, [Sky Uppercut]{move:sky-uppercut}, [Smack Down]{move:smack-down}, [Thunder]{move:thunder}, [Twister]{move:twister}, and [Whirlwind]{move:whirlwind} still hit the user normally.  [Gust]{move:gust} and [Twister]{move:twister} also have double power against the user.

The damage from [Hail]{move:hail} and [Sandstorm]{move:sandstorm} still applies during the immune turn.

The user may be hit during its immune turn if under the effect of [Lock-On]{move:lock-on}, [Mind Reader]{move:mind-reader}, or [No Guard]{ability:no-guard}.

This move cannot be used while [Gravity]{move:gravity} is in effect.

This move cannot be selected by [Sleep Talk]{move:sleep-talk}."
157,9,Raises user's Defense by one stage.,"Raises user's [Defense]{mechanic:defense} by one [stage]{mechanic:stage}.

After this move is used, the power of [Ice Ball]{move:ice-ball} and [Rollout]{move:rollout} are doubled until the user leaves the [field]{mechanic:field}."
159,9,Can only be used as the first move after the user enters battle.  Causes the target to flinch.,Inflicts [regular damage]{mechanic:regular damage}.  Causes the target to flinch.  Can only be used on the user's first turn after entering the [field]{mechanic:field}.
160,9,Forced to use this move for several turns.  Pokémon cannot fall asleep in that time.,"Inflicts [regular damage]{mechanic:regular damage}.  User is forced to use this move for 2–5 turns, selected at random.  All Pokémon on the [field]{mechanic:field} wake up, and none can fall to [sleep]{mechanic:sleep} until the lock-in ends.

Pokémon cannot use [Rest]{move:rest} during this effect.

This move cannot be selected by [Sleep Talk]{move:sleep-talk}."
161,9,Stores energy up to three times for use with Spit Up and Swallow.,"Raises the user's [Defense]{mechanic:defense} and [Special Defense]{mechanic:special defense} by one [stage]{mechanic:stage} each.  Stores energy for use with [Spit Up]{move:spit-up} and [Swallow]{move:swallow}.  Up to three levels of energy can be stored, and all are lost if the user leaves the [field]{mechanic:field}.  Energy is still stored even if the stat boosts cannot be applied.

If the user uses [Baton Pass]{move:baton-pass}, the stat boosts are passed as normal, but the stored energy is not."
162,9,Power is 100 times the amount of energy Stockpiled.,"Inflicts [regular damage]{mechanic:regular damage}.  Power is equal to 100 times the amount of energy stored by [Stockpile]{move:stockpile}.  Ignores the random factor in the damage formula.  Stored energy is consumed, and the user's [Defense]{mechanic:defense} and [Special Defense]{mechanic:special defense} are reset to what they would be if [Stockpile]{move:stockpile} had not been used.  If the user has no energy stored, this move will fail.

This move cannot be copied by [Mirror Move]{move:mirror-move}."
163,9,"Recovers 1/4 HP after one Stockpile, 1/2 HP after two Stockpiles, or full HP after three Stockpiles.","Heals the user depending on the amount of energy stored by [Stockpile]{move:stockpile}: 1/4 its max [HP]{mechanic:hp} after one use, 1/2 its max [HP]{mechanic:hp} after two uses, or fully after three uses.  Stored energy is consumed, and the user's [Defense]{mechanic:defense} and [Special Defense]{mechanic:special defense} are reset to what they would be if [Stockpile]{move:stockpile} had not been used.  If the user has no energy stored, this move will fail."
165,9,Changes the weather to a hailstorm for five turns.,"Changes the weather to hail for five turns, during which non-[Ice]{type:ice} Pokémon are damaged for 1/16 their max [HP]{mechanic:hp} at the end of every turn.

If the user is holding [Icy Rock]{item:icy-rock}, this effect lasts for eight turns.

[Blizzard]{move:blizzard} has 100% accuracy.  If the target has used [Detect]{move:detect} or [Protect]{move:protect}, [Blizzard]{move:blizzard} has a (100 - accuracy)% chance to break through the protection.

[Moonlight]{move:moonlight}, [Morning Sun]{move:morning-sun}, and [Synthesis]{move:synthesis} heal only 1/4 of the user's max [HP]{mechanic:hp}.

Pokémon with [Snow Cloak]{ability:snow-cloak} are exempt from this effect's damage."
166,9,Prevents the target from using the same move twice in a row.,"Prevents the target from attempting to use the same move twice in a row.  When the target leaves the [field]{mechanic:field}, this effect ends.

If the target is forced to attempt a repeated move due to [Choice Band]{item:choice-band}, [Choice Scarf]{item:choice-scarf}, [Choice Specs]{item:choice-specs}, [Disable]{move:disable}, [Encore]{move:encore}, [Taunt]{move:taunt}, only having [PP]{mechanic:pp} remaining for one move, or any other effect, the target will use [Struggle]{move:struggle} instead.  The target is then free to use the forced move next turn, as it didn't use that move this turn."
167,9,Raises the target's Special Attack by one stage and confuses the target.,"Raises the target's [Special Attack]{mechanic:special attack} by one [stage]{mechanic:stage}, then [confuses]{mechanic:confuses} it."
168,9,Burns the target.,[Burns]{mechanic:burns} the target.
169,9,Lowers the target's Attack and Special Attack by two stages.  User faints.,Lowers the target's [Attack]{mechanic:attack} and [Special Attack]{mechanic:special attack} by two [stages]{mechanic:stage}.  User faints.
170,9,"Power doubles if user is burned, paralyzed, or poisoned.","Inflicts [regular damage]{mechanic:regular damage}.  If the user is [burned]{mechanic:burned}, [paralyzed]{mechanic:paralyzed}, or [poisoned]{mechanic:poisoned}, this move has double power."
171,9,"If the user takes damage before attacking, the attack is canceled.","Inflicts [regular damage]{mechanic:regular damage}.  If the user takes damage this turn before hitting, this move will fail.

This move cannot be copied by [Mirror Move]{move:mirror-move}, nor selected by [Assist]{move:assist}, [Metronome]{move:metronome}, or [Sleep Talk]{move:sleep-talk}."
172,9,"If the target is paralyzed, inflicts double damage and cures the paralysis.","Inflicts [regular damage]{mechanic:regular damage}.  If the user is [paralyzed]{mechanic:paralyzed}, this move has double power, and the user is cured of its [paralysis]{mechanic:paralysis}."
173,9,Redirects the target's single-target effects to the user for this turn.,"Until the end of this turn, any moves that opposing Pokémon target solely at the user's ally will instead target the user.  If both Pokémon on the same side of the [field]{mechanic:field} use this move on the same turn, the Pokémon that uses it last will become the target.

This effect takes priority over [Lightningrod]{ability:lightningrod} and [Storm Drain]{ability:storm-drain}.

If the user's ally [switches out]{mechanic:switches out}, opposing Pokémon may still hit it with [Pursuit]{move:pursuit}.

This move cannot be selected by [Assist]{move:assist} or [Metronome]{move:metronome}."
174,9,Uses a move which depends upon the terrain.,"Uses another move chosen according to the terrain.

Terrain        | Selected move
-------------- | ------------------
Building       | [Tri Attack]{move:tri-attack}
Cave           | [Rock Slide]{move:rock-slide}
Deep water     | [Hydro Pump]{move:hydro-pump}
Desert         | [Earthquake]{move:earthquake}
Grass          | [Seed Bomb]{move:seed-bomb}
Mountain       | [Rock Slide]{move:rock-slide}
Road           | [Earthquake]{move:earthquake}
Shallow water  | [Hydro Pump]{move:hydro-pump}
Snow           | [Blizzard]{move:blizzard}
Tall grass     | [Seed Bomb]{move:seed-bomb}

In Pokémon Battle Revolution:

Terrain        | Selected move
-------------- | ------------------
Courtyard      | [Tri Attack]{move:tri-attack}
Crystal        | [Rock Slide]{move:rock-slide}
Gateway        | [Hydro Pump]{move:hydro-pump}
Magma          | [Rock Slide]{move:rock-slide}
Main Street    | [Tri Attack]{move:tri-attack}
Neon           | [Tri Attack]{move:tri-attack}
Stargazer      | [Rock Slide]{move:rock-slide}
Sunny Park     | [Seed Bomb]{move:seed-bomb}
Sunset         | [Earthquake]{move:earthquake}
Waterfall      | [Seed Bomb]{move:seed-bomb}

This move cannot be copied by [Mirror Move]{move:mirror-move}."
175,9,Raises the user's Special Defense by one stage.  User's Electric moves have doubled power next turn.,"Raises the user's [Special Defense]{mechanic:special defense} by one [stage]{mechanic:stage}.  If the user uses an [Electric]{type:electric} move next turn, its power will be doubled."
176,9,"For the next few turns, the target can only use damaging moves.","Target is forced to only use damaging moves for the next 3–5 turns, selected at random.  Moves that select other moves not known in advance do not count as damaging.

[Assist]{move:assist}, [Copycat]{move:copycat}, [Me First]{move:me-first}, [Metronome]{move:metronome}, [Mirror Move]{move:mirror-move}, and [Sleep Talk]{move:sleep-talk} do not directly inflict damage and thus may not be used.

[Bide]{move:bide}, [Counter]{move:counter}, [Endeavor]{move:endeavor}, [Metal Burst]{move:metal-burst}, and [Mirror Coat]{move:mirror-coat} are allowed."
177,9,Ally's next move inflicts half more damage.,"Boosts the power of the target's moves by 50% until the end of this turn.

This move cannot be copied by [Mirror Move]{move:mirror-move}, nor selected by [Assist]{move:assist} or [Metronome]{move:metronome}."
178,9,User and target swap items.,"User and target permanently swap [held item]{mechanic:held item}s.  Works even if one of the Pokémon isn't holding anything.  If either Pokémon is holding mail, this move will fail.

If either Pokémon has [Multitype]{ability:multitype} or [Sticky Hold]{ability:sticky-hold}, this move will fail.

If this move results in a Pokémon obtaining [Choice Band]{item:choice-band}, [Choice Scarf]{item:choice-scarf}, or [Choice Specs]{item:choice-specs}, and that Pokémon was the latter of the pair to move this turn, then the move it used this turn becomes its chosen forced move.  This applies even if both Pokémon had a choice item before this move was used.  If the first of the two Pokémon gains a choice item, it may select whatever choice move it wishes next turn.

Neither the user nor the target can recover its item with [Recycle]{move:recycle}.

This move cannot be selected by [Assist]{move:assist} or [Metronome]{move:metronome}."
179,9,Copies the target's ability.,"User's ability is replaced with the target's until the user leaves the [field]{mechanic:field}.  Ignores [accuracy]{mechanic:accuracy} and [evasion]{mechanic:evasion} modifiers.

If the target has [Wonder Guard]{ability:wonder-guard}, this move will fail.

This move cannot be copied by [Mirror Move]{move:mirror-move}."
180,9,User will recover half its max HP at the end of the next turn.,"At the end of the next turn, user will be healed for half its max [HP]{mechanic:hp}.  If the user is [switched out]{mechanic:switched out}, its replacement will be healed instead for half of the user's max HP.  If the user [faint]{mechanic:faint}s or is forcefully switched by [Roar]{move:roar} or [Whirlwind]{move:whirlwind}, this effect will not activate."
181,9,Randomly selects and uses one of the trainer's other Pokémon's moves.,"Uses a move from another Pokémon in the user's party, both selected at random.  Moves from fainted Pokémon can be used.  If there are no eligible Pokémon or moves, this move will fail.

This move will not select [Assist]{move:assist}, [Chatter]{move:chatter}, [Circle Throw]{move:circle-throw}, [Copycat]{move:copycat}, [Counter]{move:counter}, [Covet]{move:covet}, [Destiny Bond]{move:destiny-bond}, [Detect]{move:detect}, [Dragon Tail]{move:dragon-tail}, [Endure]{move:endure}, [Feint]{move:feint}, [Focus Punch]{move:focus-punch}, [Follow Me]{move:follow-me}, [Helping Hand]{move:helping-hand}, [Me First]{move:me-first}, [Metronome]{move:metronome}, [Mimic]{move:mimic}, [Mirror Coat]{move:mirror-coat}, [Mirror Move]{move:mirror-move}, [Protect]{move:protect}, [Quick Guard]{move:quick-guard}, [Sketch]{move:sketch}, [Sleep Talk]{move:sleep-talk}, [Snatch]{move:snatch}, [Struggle]{move:struggle}, [Switcheroo]{move:switcheroo}, [Thief]{move:thief}, [Trick]{move:trick}, or [Wide Guard]{move:wide-guard}.

This move cannot be copied by [Mirror Move]{move:mirror-move}, nor selected by [Metronome]{move:metronome} or [Sleep Talk]{move:sleep-talk}."
182,9,Prevents the user from leaving battle.  User regains 1/16 of its max HP every turn.,"Prevents the user from [switching out]{mechanic:switching out}.  User regains 1/16 of its max [HP]{mechanic:hp} at the end of every turn.  If the user was immune to [Ground]{type:ground} attacks, it will now take normal damage from them.

[Roar]{move:roar} and [Whirlwind]{move:whirlwind} will not affect the user.  The user cannot use [Magnet Rise]{move:magnet-rise}.

The user may still use [U-turn]{move:u-turn} to leave the [field]{mechanic:field}.

This effect can be passed with [Baton Pass]{move:baton-pass}."
183,9,Lowers the user's Attack and Defense by one stage after inflicting damage.,"Inflicts [regular damage]{mechanic:regular damage}, then lowers the user's [Attack]{mechanic:attack} and [Defense]{mechanic:defense} by one [stage]{mechanic:stage} each."
184,9,Reflects back the first effect move used on the user this turn.,"The first non-damaging move targeting the user this turn that inflicts [major status effect]{mechanic:major status effect}s, [stat change]{mechanic:stat change}s, or [trap]{mechanic:trap}ping effects will be reflected at its user.

[Defog]{move:defog}, [Memento]{move:memento}, and [Teeter Dance]{move:teeter-dance} are not reflected.

[Attract]{move:attract}, [Flatter]{move:flatter}, [Gastro Acid]{move:gastro-acid}, [Leech Seed]{move:leech-seed}, [Swagger]{move:swagger}, [Worry Seed]{move:worry-seed}, and [Yawn]{move:yawn} are reflected.

This move cannot be copied by [Mirror Move]{move:mirror-move}."
185,9,User recovers the item it last used up.,"User recovers the last item consumed by the user or a Pokémon in its position on the [field]{mechanic:field}.  The item must be used again before it can be recovered by this move again.  If the user is holding an item, this move fails.

Items taken or given away by [Covet]{move:covet}, [Knock Off]{move:knock-off}, [Switcheroo]{move:switcheroo}, [Thief]{move:thief}, or [Trick]{move:trick} may not be recovered."
186,9,Inflicts double damage if the user takes damage before attacking this turn.,"Inflicts [regular damage]{mechanic:regular damage}.  If the target damaged the user this turn and was the last to do so, this move has double power.

[Pain Split]{move:pain-split} does not count as damaging the user."
187,9,Destroys Reflect and Light Screen.,"Destroys any [Light Screen]{move:light-screen} or [Reflect]{move:reflect} on the target's side of the [field]{mechanic:field}, then inflicts [regular damage]{mechanic:regular damage}.  The barriers are destroyed even if this move has [no effect]{mechanic:no effect}."
188,9,Target sleeps at the end of the next turn.,"Puts the target to [sleep]{mechanic:sleep} at the end of the next turn.  Ignores [accuracy]{mechanic:accuracy} and [evasion]{mechanic:evasion} modifiers.  If the target leaves the [field]{mechanic:field}, this effect is canceled.  If the target has a status effect when this move is used, this move will fail.

If the target is protected by [Safeguard]{move:safeguard} when this move is used, this move will fail.

[Insomnia]{ability:insomnia} and [Vital Spirit]{ability:vital-spirit} prevent the [sleep]{mechanic:sleep} if the target has either at the end of the next turn, but will not cause this move to fail on use."
189,9,Target drops its held item.,"Inflicts [regular damage]{mechanic:regular damage}.  Target loses its [held item]{mechanic:held item}.

Neither the user nor the target can recover its item with [Recycle]{move:recycle}.

If the target has [Multitype]{ability:multitype} or [Sticky Hold]{ability:sticky-hold}, it will take damage but not lose its item."
190,9,Lowers the target's HP to equal the user's.,"Inflicts exactly enough damage to lower the target's [HP]{mechanic:hp} to equal the user's.  If the target's [HP]{mechanic:hp} is not higher than the user's, this move has no effect.  Type immunity applies, but other type effects are ignored.  This effect counts as damage for moves that respond to damage."
191,9,"Inflicts more damage when the user has more HP remaining, with a maximum of 150 power.","Inflicts [regular damage]{mechanic:regular damage}.  Power increases with the user's remaining [HP]{mechanic:hp} and is given by `150 * HP / max HP`, to a maximum of 150 when the user has full [HP]{mechanic:hp}."
192,9,User and target swap abilities.,"User and target switch abilities.  Ignores [accuracy]{mechanic:accuracy} and [evasion]{mechanic:evasion} modifiers.

If either Pokémon has [Multitype]{ability:multitype} or [Wonder Guard]{ability:wonder-guard}, this move will fail."
193,9,Prevents the target from using any moves that the user also knows.,"Prevents any Pokémon on the opposing side of the [field]{mechanic:field} from using any move the user knows until the user leaves the [field]{mechanic:field}.  This effect is live; if the user obtains new moves while on the [field]{mechanic:field}, these moves become restricted.  If no opposing Pokémon knows any of the user's moves when this move is used, this move will fail."
194,9,"Cleanses the user of a burn, paralysis, or poison.","Removes a [burn]{mechanic:burn}, [paralysis]{mechanic:paralysis}, or [poison]{mechanic:poison} from the user."
195,9,"If the user faints this turn, the PP of the move that fainted it drops to 0.","If the user [faint]{mechanic:faint}s before it next acts, the move that fainted it will have its [PP]{mechanic:pp} dropped to 0.  End-of-turn damage does not trigger this effect."
196,9,"Steals the target's move, if it's self-targeted.","The next time a Pokémon uses a beneficial move on itself or itself and its ally this turn, the user of this move will steal the move and use it itself.  Moves which may be stolen by this move are identified by the ""snatchable"" flag.

If two Pokémon use this move on the same turn, the faster Pokémon will steal the first beneficial move, and the slower Pokémon will then steal it again—thus, only the slowest Pokémon using this move ultimately gains a stolen move's effect.

If the user steals [Psych Up]{move:psych-up}, it will target the Pokémon that used [Psych Up]{move:psych-up}.  If the user was the original target of [Psych Up]{move:psych-up}, and the Pokémon that originally used it's affected by [Pressure]{ability:pressure}, it will only lose 1 [PP]{mechanic:pp}.

This move cannot be copied by [Mirror Move]{move:mirror-move}, nor selected by [Assist]{move:assist} or [Metronome]{move:metronome}."
197,9,"Inflicts more damage to heavier targets, with a maximum of 120 power.","Inflicts [regular damage]{mechanic:regular damage}.  Power increases with the target's weight in kilograms, to a maximum of 120.

Target's weight | Power
--------------- | ----:
Up to 10kg      |    20
Up to 25kg      |    40
Up to 50kg      |    60
Up to 100kg     |    80
Up to 200kg     |   100
Above 200kg     |   120
"
198,9,Has a $effect_chance% chance to inflict a status effect which depends upon the terrain.,"Inflicts [regular damage]{mechanic:regular damage}.  Has a $effect_chance% chance to inflict an effect chosen according to the terrain.

Terrain        | Effect
-------------- | -------------------------------------------------------------
Building       | [Paralyze]{mechanic:paralyze}s target
Cave           | Makes target [flinch]{mechanic:flinch}
Deep water     | Lowers target's [Attack]{mechanic:attack} by one [stage]{mechanic:stage}
Desert         | Lowers target's [accuracy]{mechanic:accuracy} by one [stage]{mechanic:stage}
Grass          | Puts target to [sleep]{mechanic:sleep}
Mountain       | Makes target [flinch]{mechanic:flinch}
Road           | Lowers target's [accuracy]{mechanic:accuracy} by one [stage]{mechanic:stage}
Shallow water  | Lowers target's [Attack]{mechanic:attack} by one [stage]{mechanic:stage}
Snow           | [Freezes]{mechanic:freezes} target
Tall grass     | Puts target to [sleep]{mechanic:sleep}

In Pokémon Battle Revolution:

Terrain        | Effect
-------------- | -------------------------------------------------------------
Courtyard      | [Paralyze]{mechanic:paralyze}s target
Crystal        | Makes target [flinch]{mechanic:flinch}
Gateway        | Lowers target's [Attack]{mechanic:attack} by one [stage]{mechanic:stage}
Magma          | Makes target [flinch]{mechanic:flinch}
Main Street    | [Paralyze]{mechanic:paralyze}s target
Neon           | [Paralyze]{mechanic:paralyze}s target
Stargazer      | Makes target [flinch]{mechanic:flinch}
Sunny Park     | Puts target to [sleep]{mechanic:sleep}
Sunset         | Lowers target's [accuracy]{mechanic:accuracy} by one [stage]{mechanic:stage}
Waterfall      | Puts target to [sleep]{mechanic:sleep}
"
